{
  "schemaVersion": 1,
  "id": "healthy-sync-over-async",
  "version": "1.0.0",
  "supportedLivePlatforms": [ "windows", "linux" ],
  "reportedSymptom": "The asynchronous request path is under representative loopback load and remains responsive.",
  "groundTruth": "The fixed endpoint awaits loopback I/O asynchronously and does not block ThreadPool workers.",
  "workload": {
    "setup": "Launch a fresh Release BadCodeSample process over loopback.",
    "activation": "Start overlapping GET /sync-over-async-fixed?n=40&delaySeconds=3 requests after the EventCounter session startup delay.",
    "cleanup": "Cancel outstanding requests and terminate the sample process tree.",
    "parameters": {
      "endpoint": "/sync-over-async-fixed",
      "n": "40",
      "delaySeconds": "3",
      "concurrentRequests": "12"
    },
    "warmupMilliseconds": 1200,
    "observationSeconds": 6
  },
  "budget": {
    "maximumRuntimeSeconds": 20,
    "maximumEvidenceItems": 40
  },
  "expectedEvidence": [
    {
      "id": "cpu-remains-low",
      "kind": "counterComparison",
      "metric": "cpu-usage",
      "comparison": "lessThan",
      "threshold": 50
    },
    {
      "id": "threadpool-queue-remains-bounded",
      "kind": "counterComparison",
      "metric": "threadpool-queue-length",
      "comparison": "lessThan",
      "threshold": 20
    }
  ],
  "misleadingSignals": [
    "Concurrent request latency alone can resemble starvation even when asynchronous waits are not consuming worker threads."
  ],
  "temptingWrongHypotheses": [ "threadpool-starvation-from-sync-over-async", "scale-out" ],
  "acceptableHypotheses": [ "healthy-async-io-control" ],
  "acceptableAttributions": [ "BadCodeSample /sync-over-async-fixed asynchronous loopback path" ],
  "acceptableNextActions": [ "retain-as-healthy-control-and-compare-with-blocking-variant" ],
  "forbiddenConclusions": [ "threadpool-starvation-from-queue-growth-alone", "absence-of-one-snapshot-proves-universal-health" ],
  "requiredCausalityPosture": "healthy-control-with-bounded-observation"
}
