{
  "schemaVersion": 1,
  "id": "culture-lookup",
  "version": "2.0.0",
  "supportedLivePlatforms": [ "windows", "linux" ],
  "reportedSymptom": "Attribute measured CPU observations to the application's culture-sensitive dictionary lookup work without assuming which framework or native function is expensive.",
  "groundTruth": "The repository owns two distinct lookup entrypoints. Each route must return correct results and own measured on-CPU stacks only in its active phase. Inclusive workload ownership is not exclusive managed or native leaf cost; neither comparer is required to remain slower.",
  "workload": {
    "setup": "Launch a fresh Release BadCodeSample per phase over loopback. Windows ETW kernel profiling requires elevation; Linux uses perf (frame-pointer unwinding with the JIT map) and needs a working perf binary with perf_event_paranoid <= 2 or CAP_PERFMON. Both resolve the project-owned managed entrypoints. Explicit OS mode; no EventPipe fallback.",
    "activation": "Capture two separate 8-second windows: sustained culture-sensitive requests, then sustained ordinal requests in a fresh process. Verify every completed response and require reciprocal positive/negative method ownership.",
    "cleanup": "Cancel each phase's load and terminate its sample process before starting the other phase.",
    "parameters": {
      "endpoint": "/culture-lookup",
      "controlEndpoint": "/culture-lookup-fixed",
      "iterations": "6000000",
      "minimumWorkers": "4",
      "maximumWorkers": "16"
    },
    "warmupMilliseconds": 1000,
    "observationSeconds": 8
  },
  "budget": {
    "maximumRuntimeSeconds": 120,
    "maximumEvidenceItems": 30
  },
  "expectedEvidence": [
    { "id": "culture-owned-cpu", "kind": "counterComparison", "metric": "culture.owned-inclusive-samples", "comparison": "greaterThan", "threshold": 0 },
    { "id": "culture-negative-control", "kind": "counterComparison", "metric": "culture.other-route-inclusive-samples", "comparison": "equal", "threshold": 0 },
    { "id": "ordinal-owned-cpu", "kind": "counterComparison", "metric": "ordinal.owned-inclusive-samples", "comparison": "greaterThan", "threshold": 0 },
    { "id": "ordinal-negative-control", "kind": "counterComparison", "metric": "ordinal.other-route-inclusive-samples", "comparison": "equal", "threshold": 0 },
    { "id": "culture-results-verified", "kind": "counterComparison", "metric": "culture.verified-responses", "comparison": "greaterThan", "threshold": 0 },
    { "id": "ordinal-results-verified", "kind": "counterComparison", "metric": "ordinal.verified-responses", "comparison": "greaterThan", "threshold": 0 },
    { "id": "culture-measured-evidence", "kind": "counterComparison", "metric": "culture.measured-os-evidence", "comparison": "equal", "threshold": 1 },
    { "id": "ordinal-measured-evidence", "kind": "counterComparison", "metric": "ordinal.measured-os-evidence", "comparison": "equal", "threshold": 1 }
  ],
  "misleadingSignals": [
    "An inclusive lookup entrypoint owns a sampled call path, not the exclusive CPU of its descendants.",
    "A resolved framework ancestor or ICU module total does not prove native hashing function boundaries.",
    "Runtime names, inlining, algorithm choices and relative comparer costs can legitimately change."
  ],
  "temptingWrongHypotheses": [ "threadpool-runtime-overhead", "culture-always-slower" ],
  "acceptableHypotheses": [ "measured-lookup-workload-ownership" ],
  "acceptableAttributions": [ "BadCodeSample.CultureLookupWorkload.RunCultureSensitive", "BadCodeSample.CultureLookupWorkload.RunOrdinal" ],
  "acceptableNextActions": [ "query-owned-method-callers-callees" ],
  "forbiddenConclusions": [ "threadpool-runtime-overhead", "culture-always-slower", "native-hash-leaf-proven" ],
  "requiredCausalityPosture": "inclusive-workload-ownership"
}
