{
  "schemaVersion": 1,
  "id": "gc-storm",
  "version": "1.0.0",
  "supportedLivePlatforms": [ "windows", "linux" ],
  "reportedSymptom": "Tail latency spikes while requests mostly allocate and free memory.",
  "groundTruth": "Repeated LOH allocations force frequent gen2 collections and sustained GC pause pressure over the observation window.",
  "workload": {
    "setup": "Launch a fresh Release BadCodeSample process over loopback.",
    "activation": "Start repeated GET /loh-alloc?count=200 requests after warmup and drive them throughout the counter window. Then stop issuing requests, await in-flight handlers, and retain a two-second GC observation tail so the final collection can complete.",
    "cleanup": "Cancel load generation and terminate the sample process tree.",
    "parameters": {
      "endpoint": "/loh-alloc",
      "count": "200",
      "concurrentRequests": "4",
      "drainSeconds": "2"
    },
    "warmupMilliseconds": 1200,
    "observationSeconds": 8
  },
  "budget": {
    "maximumRuntimeSeconds": 15,
    "maximumEvidenceItems": 40
  },
  "expectedEvidence": [
    {
      "id": "gen2-counter-elevated",
      "kind": "counterComparison",
      "metric": "gen-2-gc-count",
      "comparison": "greaterThanOrEqual",
      "threshold": 10
    },
    {
      "id": "loh-size-elevated",
      "kind": "counterComparison",
      "metric": "loh-size-max",
      "comparison": "greaterThanOrEqual",
      "threshold": 1000000
    },
    {
      "id": "gen2-share-signal",
      "kind": "signalBucketMatch",
      "signal": "gc.gen2-share",
      "containsAny": [ "gen2" ],
      "comparison": "greaterThanOrEqual",
      "threshold": 10
    }
  ],
  "misleadingSignals": [
    "CPU can look moderate even when pause frequency and LOH growth are driving latency instability.",
    "Retained LOH size at the final sample can read as 0 B even under sustained churn, because a gen2 collection can reclaim the LOH between the last allocation burst and the final counter tick; use the windowed peak (loh-size-max), not the final value, as evidence."
  ],
  "temptingWrongHypotheses": [ "cpu-hot-loop", "thread-wait-contention" ],
  "acceptableHypotheses": [ "gc-pause-pressure-from-loh-churn" ],
  "acceptableAttributions": [ "BadCodeSample /loh-alloc large-object allocations" ],
  "acceptableNextActions": [ "inspect-gc-timeline-and-generation-breakdown" ],
  "forbiddenConclusions": [ "cpu-hot-loop", "thread-wait-contention", "single-pause-proves-root-cause" ],
  "requiredCausalityPosture": "multi-signal-gc-correlation"
}
